{
  "agent_name": "AgentXYZ_v1",
  "provider": {
    "company_name": "FinSecure AI Ltd",
    "website": "https://finsecure.ai",
    "contact_email": "compliance@finsecure.ai"
  },
  "primary_use_case": "Retail banking chatbot",
  "industry_vertical": "Finance",
  "deployment_status": "Production",
  "compliance": {
    "standards": [
      "GDPR",
      "SOC 2"
    ],
    "audit_report_available": true,
    "last_audit_date": "2024-12-01"
  },
  "risk_profile": {
    "risk_level": "High",
    "incident_history": false
  },
  "explainability": {
    "support": "Partial",
    "techniques": [
      "Model Card"
    ]
  },
  "bias_mitigation": {
    "enabled": true
  },
  "trust_metadata": {
    "self_certified": true,
    "certification_status": "pending-review",
    "submitted_on": "2025-05-26"
  }
}
